{
  "$schema": "https://json-schema.org/draft/2020-12/schema",
  "title": "GitHub Profile Agent Console Configuration",
  "type": "object",
  "additionalProperties": false,
  "required": [
    "profile",
    "research",
    "focus",
    "projects",
    "techStack",
    "links",
    "activity",
    "appearance",
    "footer"
  ],
  "properties": {
    "$schema": {
      "type": "string"
    },
    "profile": {
      "type": "object",
      "additionalProperties": false,
      "required": [
        "name",
        "username",
        "headline",
        "affiliation",
        "location",
        "status",
        "about"
      ],
      "properties": {
        "name": {
          "type": "string",
          "minLength": 2,
          "maxLength": 40
        },
        "username": {
          "type": "string",
          "pattern": "^[A-Za-z0-9](?:[A-Za-z0-9-]{0,37}[A-Za-z0-9])?$"
        },
        "headline": {
          "type": "string",
          "minLength": 3,
          "maxLength": 46
        },
        "affiliation": {
          "type": "string",
          "minLength": 2,
          "maxLength": 40
        },
        "location": {
          "type": "string",
          "minLength": 2,
          "maxLength": 32
        },
        "status": {
          "type": "string",
          "minLength": 2,
          "maxLength": 42
        },
        "about": {
          "type": "array",
          "minItems": 1,
          "maxItems": 3,
          "items": {
            "type": "string",
            "minLength": 20,
            "maxLength": 320
          }
        }
      }
    },
    "research": {
      "type": "object",
      "additionalProperties": false,
      "required": [
        "primary",
        "direction",
        "themes",
        "narrative"
      ],
      "properties": {
        "primary": {
          "type": "string",
          "minLength": 2,
          "maxLength": 28
        },
        "direction": {
          "type": "string",
          "minLength": 2,
          "maxLength": 38
        },
        "themes": {
          "type": "string",
          "minLength": 2,
          "maxLength": 46
        },
        "narrative": {
          "type": "string",
          "minLength": 20,
          "maxLength": 420
        }
      }
    },
    "focus": {
      "type": "array",
      "minItems": 1,
      "maxItems": 6,
      "items": {
        "type": "object",
        "additionalProperties": false,
        "required": [
          "name",
          "description"
        ],
        "properties": {
          "name": {
            "type": "string",
            "minLength": 2,
            "maxLength": 28
          },
          "description": {
            "type": "string",
            "minLength": 10,
            "maxLength": 180
          }
        }
      }
    },
    "projects": {
      "type": "array",
      "minItems": 1,
      "maxItems": 6,
      "items": {
        "type": "object",
        "additionalProperties": false,
        "required": [
          "name",
          "url",
          "focus",
          "summary",
          "heroLabel"
        ],
        "properties": {
          "name": {
            "type": "string",
            "minLength": 2,
            "maxLength": 18
          },
          "url": {
            "type": "string",
            "format": "uri"
          },
          "homepage": {
            "type": "string"
          },
          "focus": {
            "type": "string",
            "minLength": 2,
            "maxLength": 44
          },
          "summary": {
            "type": "string",
            "minLength": 10,
            "maxLength": 220
          },
          "heroLabel": {
            "type": "string",
            "minLength": 2,
            "maxLength": 30
          }
        }
      }
    },
    "techStack": {
      "type": "array",
      "minItems": 1,
      "maxItems": 18,
      "items": {
        "type": "string",
        "minLength": 1,
        "maxLength": 30
      }
    },
    "links": {
      "type": "array",
      "minItems": 1,
      "maxItems": 4,
      "items": {
        "type": "object",
        "additionalProperties": false,
        "required": [
          "label",
          "value",
          "url",
          "logo",
          "color"
        ],
        "properties": {
          "label": {
            "type": "string",
            "minLength": 2,
            "maxLength": 14
          },
          "value": {
            "type": "string",
            "minLength": 1,
            "maxLength": 28
          },
          "url": {
            "type": "string",
            "format": "uri"
          },
          "logo": {
            "type": "string",
            "maxLength": 30
          },
          "color": {
            "type": "string",
            "pattern": "^[A-Fa-f0-9]{6}$"
          }
        }
      }
    },
    "activity": {
      "type": "object",
      "additionalProperties": false,
      "required": [
        "enabled",
        "limit"
      ],
      "properties": {
        "enabled": {
          "type": "boolean"
        },
        "limit": {
          "type": "integer",
          "minimum": 1,
          "maximum": 10
        }
      }
    },
    "appearance": {
      "type": "object",
      "additionalProperties": false,
      "required": [
        "palette"
      ],
      "properties": {
        "palette": {
          "enum": [
            "signal",
            "ocean",
            "solar"
          ]
        }
      }
    },
    "footer": {
      "type": "string",
      "minLength": 4,
      "maxLength": 120
    },
    "typing": {
      "type": "array",
      "maxItems": 8,
      "items": {
        "type": "string",
        "minLength": 2,
        "maxLength": 60
      }
    },
    "highlights": {
      "type": "array",
      "maxItems": 4,
      "items": {
        "type": "object",
        "additionalProperties": false,
        "required": [
          "value",
          "label"
        ],
        "properties": {
          "value": {
            "type": "string",
            "maxLength": 10
          },
          "label": {
            "type": "string",
            "maxLength": 40
          }
        }
      }
    },
    "publications": {
      "type": "array",
      "maxItems": 6,
      "items": {
        "type": "object",
        "additionalProperties": false,
        "required": [
          "year",
          "title",
          "venue",
          "url"
        ],
        "properties": {
          "year": {
            "type": "string"
          },
          "title": {
            "type": "string",
            "maxLength": 240
          },
          "authors": {
            "type": "string",
            "maxLength": 200
          },
          "venue": {
            "type": "string",
            "maxLength": 120
          },
          "url": {
            "type": "string",
            "format": "uri"
          }
        }
      }
    },
    "techIcons": {
      "type": "string",
      "pattern": "^[a-z0-9,]+$",
      "maxLength": 200,
      "description": "Comma-separated skillicons.dev ids"
    },
    "repository": {
      "type": "string",
      "pattern": "^[A-Za-z0-9-]+/[A-Za-z0-9._-]+$",
      "description": "Repository hosting this README (owner/name). Defaults to username/username."
    }
  }
}
