{
  "$schema": "./profile.schema.json",
  "profile": {
    "name": "Kiran Babu Athina",
    "username": "FriendyKiran",
    "headline": "Machine Learning & AI Engineer",
    "affiliation": "Texas A&M University · AISLS Lab",
    "location": "College Station, TX",
    "status": "Open to ML / AI Engineer roles",
    "about": [
      "I'm a Machine Learning and AI Engineer with four years of experience shipping production ML across telecom, finance, healthcare, and agricultural research. At Texas A&M's AISLS Lab I build agentic RAG systems over knowledge graphs and fine-tune open LLMs on local GPU infrastructure.",
      "Before that, at Tata Consultancy Services, I engineered PySpark pipelines, NLP classifiers, and multimodal QC models on Docker and Kubernetes. I don't call a model done until it has a held-out eval set, a baseline to beat, and a recommendation people can act on."
    ]
  },
  "repository": "FriendyKiran/FriendyKiran",
  "research": {
    "primary": "Agentic RAG & LLMs",
    "direction": "Grounded, evaluated AI in production",
    "themes": "Knowledge graphs / LoRA / multimodal",
    "narrative": "I'm interested in retrieval systems that can route questions to the right knowledge source, cite their evidence, and be measured against a held-out eval set, plus fine-tuning open models so domain queries never need a general-purpose cloud API."
  },
  "focus": [
    {
      "name": "Agentic RAG",
      "description": "Query routing over fine-tuned knowledge-graph retrievers, hybrid BM25 + FAISS search, and source-level citations."
    },
    {
      "name": "LLM Fine-tuning",
      "description": "LoRA / QLoRA / PEFT on Gemma and LLaMA for domain corpora, trained on local GPU clusters."
    },
    {
      "name": "Multimodal Models",
      "description": "Vision-language models for medical imaging and CLIP-style contrastive learning."
    },
    {
      "name": "Production ML",
      "description": "PySpark ETL at 100M+ records/day, drift monitoring, and Docker + Kubernetes deployment."
    }
  ],
  "projects": [
    {
      "name": "KG Agentic RAG",
      "url": "https://kiranbabuathina.com/#projects",
      "homepage": "",
      "focus": "Agentic retrieval over knowledge graphs",
      "summary": "Query-routing layer over 3 fine-tuned knowledge-graph retrievers on TAMU HPC (2x RTX 6000). **98.7% Recall@5** on a held-out eval set.",
      "heroLabel": "98.7% Recall@5"
    },
    {
      "name": "Azure RAG Platform",
      "url": "https://kiranbabuathina.com/#projects",
      "homepage": "",
      "focus": "Source-grounded RAG on Azure",
      "summary": "FastAPI + React chat over 120,000+ chunks with hybrid BM25 + FAISS and top-5 source traceability. **95% Hit@5, 0.925 MRR** on 1,000 expert questions.",
      "heroLabel": "95% Hit@5 / 0.925 MRR"
    },
    {
      "name": "Retinal VLM",
      "url": "https://kiranbabuathina.com/#projects",
      "homepage": "",
      "focus": "Vision-language models for healthcare",
      "summary": "Fine-tuned MedGemma 4B on paired fundus images and clinical notes, validated on 1,200+ expert-annotated images. **91% accuracy across 12 diseases.**",
      "heroLabel": "91% acc / 12 diseases"
    },
    {
      "name": "Exoplanet ML",
      "url": "https://github.com/FriendyKiran/Exoplanet-Discovery-using-Machine-Learning",
      "homepage": "",
      "focus": "NASA Space Apps 2025",
      "summary": "Ensemble of RF, XGBoost, LightGBM, Gradient Boosting, and MLP classifying Kepler + TESS objects, served as a Streamlit app. **96.64% accuracy.**",
      "heroLabel": "96.64% acc / NASA Space Apps"
    },
    {
      "name": "CLIP Contrastive",
      "url": "https://kiranbabuathina.com/#projects",
      "homepage": "",
      "focus": "Multimodal contrastive learning",
      "summary": "Dual-encoder ResNet-50 + DistilBERT trained with NT-Xent and iSogCLR losses. **+17% image-text retrieval on MSCOCO, +14% zero-shot on ImageNet** vs. baseline CLIP.",
      "heroLabel": "+17% retrieval on MSCOCO"
    },
    {
      "name": "Livestock Twin",
      "url": "https://kiranbabuathina.com/#projects",
      "homepage": "",
      "focus": "Sensor-driven digital twin",
      "summary": "Agent-based simulation (Mesa) fed by live MQTT sensor streams, tracking per-animal energy by the minute and forecasting monthly methane.",
      "heroLabel": "Minute-level CH4 tracking"
    }
  ],
  "techStack": [
    "Python",
    "SQL",
    "PyTorch",
    "Hugging Face",
    "LangChain",
    "LangGraph",
    "FAISS",
    "Scikit-learn",
    "XGBoost",
    "FastAPI",
    "React",
    "PySpark",
    "Azure OpenAI",
    "Azure ML",
    "AWS SageMaker",
    "Docker",
    "Kubernetes",
    "PostgreSQL"
  ],
  "techIcons": "python,pytorch,tensorflow,sklearn,fastapi,react,docker,kubernetes,azure,aws,postgres,mongodb,redis,git,linux",
  "links": [
    {
      "label": "Portfolio",
      "value": "kiranbabuathina.com",
      "url": "https://kiranbabuathina.com",
      "logo": "googlechrome",
      "color": "0891B2"
    },
    {
      "label": "LinkedIn",
      "value": "athinakiranbabu",
      "url": "https://www.linkedin.com/in/athinakiranbabu",
      "logo": "linkedin",
      "color": "0A66C2"
    },
    {
      "label": "Scholar",
      "value": "Kiran Babu Athina",
      "url": "https://scholar.google.com/citations?user=wWen3jgAAAAJ&hl=en",
      "logo": "googlescholar",
      "color": "4285F4"
    },
    {
      "label": "Email",
      "value": "kiranathina8@gmail.com",
      "url": "mailto:kiranathina8@gmail.com",
      "logo": "gmail",
      "color": "D14836"
    }
  ],
  "typing": [
    "I build agentic RAG systems.",
    "I fine-tune LLMs with LoRA.",
    "I train multimodal models.",
    "I run PySpark at 100M+ records/day.",
    "I ship AI with an eval set."
  ],
  "highlights": [
    {
      "value": "4+",
      "label": "Years building production ML"
    },
    {
      "value": "98.7%",
      "label": "Recall@5, agentic KG-RAG"
    },
    {
      "value": "100M+",
      "label": "Records/day through PySpark ETL"
    },
    {
      "value": "3.9",
      "label": "GPA, M.S. Data Science (TAMU)"
    }
  ],
  "publications": [
    {
      "year": "2025",
      "title": "An agent-based framework of cattle value discovery system for precision nutrient requirements and utilization prediction of beef cattle",
      "venue": "CABI Digital Library · Vol. 16, Issue 3",
      "url": "https://www.cabidigitallibrary.org/doi/full/10.5555/20250456444",
      "authors": "K. Kaniyamattam, V. Kulangara-Veettil, P. Kundu, **K. B. Athina**, L. O. Tedeschi"
    }
  ],
  "activity": {
    "enabled": true,
    "limit": 6
  },
  "appearance": {
    "palette": "signal"
  },
  "footer": "Every model ships with an eval set and a baseline to beat."
}
